{
  "snapshot_id": "SNAPSHOT-FOUNDER-VALIDATE-001-AFTER",
  "portfolio_id": "PORTFOLIO-FOUNDER-001",
  "base_currency": "CHF",
  "observed_at": "2026-07-20T12:00:00+00:00",
  "source": {
    "source_id": "SOURCE-FOUNDER-VALIDATE-001-AFTER",
    "provider_name": "FOUNDER_FIXTURE",
    "source_type": "MANUAL_FIXTURE",
    "account_reference": "ACCOUNT-REDACTED-001",
    "read_only": true,
    "provenance": {
      "source_filename": "founder-after.synthetic.fixture.csv",
      "source_sha256": "2222222222222222222222222222222222222222222222222222222222222222",
      "imported_at": "2026-07-20T12:05:00+00:00",
      "source_row_count": 2
    }
  },
  "holdings": [
    {
      "holding_id": "HOLDING-MAIN-001",
      "symbol": "MAIN",
      "name": "Main Street Capital",
      "quantity": "2.0000",
      "market_value": {
        "amount": "112.40",
        "currency": "CHF"
      },
      "weight": "0.4805472424112868747327917914",
      "observed_at": "2026-07-20T12:00:00+00:00",
      "average_entry_price": null,
      "unknowns": [
        {
          "field_name": "average_entry_price",
          "reason": "SOURCE_FIELD_EMPTY",
          "source_detail": "The source row did not contain an average entry price."
        }
      ]
    },
    {
      "holding_id": "HOLDING-VUAG-001",
      "symbol": "VUAG",
      "name": "Vanguard S&P 500 UCITS ETF",
      "quantity": "1.2500",
      "market_value": {
        "amount": "121.50",
        "currency": "CHF"
      },
      "weight": "0.5194527575887131252672082086",
      "observed_at": "2026-07-20T12:00:00+00:00",
      "average_entry_price": {
        "amount": "91.20",
        "currency": "CHF"
      },
      "unknowns": []
    }
  ],
  "cash_balances": [],
  "total_value": {
    "amount": "233.90",
    "currency": "CHF"
  },
  "unknowns": []
}
